{
  "schemaVersion": "jobservatory.release-readiness.v1",
  "generatedAt": "2026-08-25T09:52:56+00:00",
  "status": "blocked",
  "passed": 4,
  "total": 13,
  "gates": [
    {
      "id": "corpus.source_universe",
      "name": "Declared source universe is complete",
      "status": "pass",
      "evidence": "public/api/observatory.json coverage"
    },
    {
      "id": "corpus.rights",
      "name": "Every source has approved retrieval, retention, excerpt publication, redistribution, and training rights",
      "status": "fail",
      "evidence": "public/api/governance/source-rights-register.json plus config/assurance.json"
    },
    {
      "id": "onet.human_review",
      "name": "Occupation and skill mappings are human reviewed",
      "status": "fail",
      "evidence": "config/assurance.json"
    },
    {
      "id": "evaluation.independent",
      "name": "Retrieval and classification sets are independently annotated and adjudicated",
      "status": "fail",
      "evidence": "public/api/ml/independent-evaluation-readiness.json plus config/assurance.json"
    },
    {
      "id": "retrieval.promotion",
      "name": "Learned retrieval clears BM25 quality and evidence gates",
      "status": "fail",
      "evidence": "public/api/ml/learned-retrieval-metrics.json"
    },
    {
      "id": "classification.promotion",
      "name": "Calibrated hierarchical classifier clears evidence gates",
      "status": "fail",
      "evidence": "public/api/ml/hierarchical-classifier-metrics.json"
    },
    {
      "id": "responsible_ai.counterfactuals",
      "name": "Scoped protected-attribute counterfactual tests pass",
      "status": "pass",
      "evidence": "public/api/ml/counterfactual-audit.json plus config/assurance.json"
    },
    {
      "id": "longitudinal.signal",
      "name": "Longitudinal signal has sufficient valid history",
      "status": "fail",
      "evidence": "public/api/apocalypso/jobs-signal.json"
    },
    {
      "id": "serving.architecture",
      "name": "Versioned production baseline retrieval service is deployed and benchmarked",
      "status": "fail",
      "evidence": "public/api/search/manifest-v1.json plus public/api/ops/retrieval-service-benchmark.json plus config/assurance.json"
    },
    {
      "id": "serving.benchmark",
      "name": "Production benchmark has zero errors",
      "status": "pass",
      "evidence": "public/api/ops/production-benchmark.json"
    },
    {
      "id": "accessibility.automated",
      "name": "Built UI passes automated WCAG and keyboard interaction audits",
      "status": "pass",
      "evidence": "public/api/ops/accessibility-audit.json plus config/assurance.json"
    },
    {
      "id": "accessibility.assistive_technology",
      "name": "Qualified human assistive-technology audit passes",
      "status": "fail",
      "evidence": "config/assurance.json plus linked human audit report"
    },
    {
      "id": "deployment.automatic",
      "name": "GitHub-to-Cloudflare deployment is automatic and verified",
      "status": "fail",
      "evidence": "config/assurance.json"
    }
  ],
  "responsibleAI": {
    "employmentDecisionUse": "prohibited",
    "candidateMatching": "disabled",
    "protectedAttributeFeatures": "prohibited",
    "humanReviewRequired": true,
    "explanationPolicy": "Only cited listing or candidate passages may support explanations; no candidate model is deployed."
  }
}
